GPU-tuning/AD4000_wmma_complex_gemm_opt_16bit_1x4096x4096x4096.json
{
"device_name": "NVIDIA RTX 4000 Ada Generation",
"kernel_name": "wmma_complex_gemm_opt",
"problem_size": [
4096,
4096,
1
],
"tune_params_keys": [
"nvml_gr_clock",
"block_size_x",
"block_size_y",
"block_size_z",
"M_PER_BLOCK",
"N_PER_BLOCK",
"NBUFFER"
],
"tune_params": {
"nvml_gr_clock": [
1485,
1515,
1560,
1590,
1635,
1665,
1710,
1740,
1785,
1815
],
"block_size_x": [
32
],
"block_size_y": [
1,
2,
4,
8,
16,
32
],
"block_size_z": [
1,
2,
4,
8,
16,
32
],
"M_PER_BLOCK": [
16,
32,
64,
128,
256
],
"N_PER_BLOCK": [
8,
16,
32,
64,
128,
256
],
"NBUFFER": [
1,
2,
4,
8
]
},
"objective": "TFLOPS/J",
"cache": {
"1485,32,1,1,16,16,1": {"nvml_gr_clock": 1485, "block_size_x": 32, "block_size_y": 1, "block_size_z": 1, "M_PER_BLOCK": 16, "N_PER_BLOCK": 16, "NBUFFER": 1, "ps_energy": 2.071375543359622, "ps_power": 74.26952613231968, "core_freq": 1485.0, "temperature": 49.97826086956521, "time": 27.652827399117605, "times": [27.656192779541016, 27.655168533325195, 27.633663177490234, 27.633663177490234, 27.649023056030273, 27.664384841918945, 27.677696228027344], "compile_time": 0.10163895785808563, "verification_time": 0, "benchmark_time": 197.33785185962915, "TFLOPS": 19.880636650758635, "N_PER_WARP": 16, "M_PER_WARP": 16, "Watt": 74.26952613231968, "TFLOPS/J": 0.26540615276181917, "strategy_time": 0, "framework_time": 0, "timestamp": "2024-11-19 19:22:35.474035+00:00"},
"1485,32,1,1,16,16,2": {"nvml_gr_clock": 1485, "block_size_x": 32, "block_size_y": 1, "block_size_z": 1, "M_PER_BLOCK": 16, "N_PER_BLOCK": 16, "NBUFFER": 2, "ps_energy": 2.136869972305533, "ps_power": 73.46733172960481, "core_freq": 1485.0, "temperature": 48.697540554683414, "time": 28.924781799316406, "times": [29.693952560424805, 28.74470329284668, 28.793855667114258, 28.845056533813477, 28.77849578857422, 28.850175857543945, 28.76723289489746], "compile_time": 1401.2257112190127, "verification_time": 0, "benchmark_time": 205.36297280341387, "TFLOPS": 19.006394506353466, "N_PER_WARP": 16, "M_PER_WARP": 16, "Watt": 73.46733172960481, "TFLOPS/J": 0.2572715331363153, "strategy_time": 0, "framework_time": 2.528953365981579, "timestamp": "2024-11-19 19:22:37.083237+00:00"},
"1485,32,1,1,16,16,4": {"nvml_gr_clock": 1485, "block_size_x": 32, "block_size_y": 1, "block_size_z": 1, "M_PER_BLOCK": 16, "N_PER_BLOCK": 16, "NBUFFER": 4, "ps_energy": 2.3790728841107125, "ps_power": 71.2802376965907, "core_freq": 1485.0, "temperature": 48.58199279711885, "time": 33.254399163382395, "times": [28.674047470092773, 34.89689636230469, 28.872703552246094, 32.98099136352539, 33.37420654296875, 39.26015853881836, 34.7217903137207], "compile_time": 1010.2900266647339, "verification_time": 0, "benchmark_time": 235.83458457142115, "TFLOPS": 16.531822186502044, "N_PER_WARP": 16, "M_PER_WARP": 16, "Watt": 71.2802376965907, "TFLOPS/J": 0.23107985365210718, "strategy_time": 0, "framework_time": 2.12683342397213, "timestamp": "2024-11-19 19:22:38.331516+00:00"},
"1485,32,1,1,16,16,8": {"nvml_gr_clock": 1485, "block_size_x": 32, "block_size_y": 1, "block_size_z": 1, "M_PER_BLOCK": 16, "N_PER_BLOCK": 16, "NBUFFER": 8, "ps_energy": 3.2911405140689, "ps_power": 65.45579788118336, "core_freq": 1485.0, "temperature": 48.263513844645914, "time": 50.138550894601, "times": [50.2026252746582, 50.12684631347656, 50.12684631347656, 50.157569885253906, 50.130943298339844, 50.109439849853516, 50.11558532714844], "compile_time": 1039.4382514059544, "verification_time": 0, "benchmark_time": 353.98999508470297, "TFLOPS": 10.964732806970666, "N_PER_WARP": 16, "M_PER_WARP": 16, "Watt": 65.45579788118336, "TFLOPS/J": 0.16704112496501292, "strategy_time": 0, "framework_time": 1.9100494682788849, "timestamp": "2024-11-19 19:22:39.726884+00:00"},
"1485,32,1,1,16,32,1": {"nvml_gr_clock": 1485, "block_size_x": 32, "block_size_y": 1, "block_size_z": 1, "M_PER_BLOCK": 16, "N_PER_BLOCK": 32, "NBUFFER": 1, "ps_energy": 1.4975782772965789, "ps_power": 71.25952698364983, "core_freq": 1485.0, "temperature": 48.285487528344675, "time": 20.885650089808873, "times": [20.884479522705078, 20.884479522705078, 20.87424087524414, 20.891647338867188, 20.899839401245117, 20.85478401184082, 20.910079956054688], "compile_time": 1025.2224635332823, "verification_time": 0, "benchmark_time": 148.85018859058619, "TFLOPS": 26.322178698007235, "N_PER_WARP": 32, "M_PER_WARP": 16, "Watt": 71.25952698364983, "TFLOPS/J": 0.3670965466195307, "strategy_time": 0, "framework_time": 1.9983425736427307, "timestamp": "2024-11-19 19:22:40.902985+00:00"},
"1485,32,1,1,16,32,2": {"nvml_gr_clock": 1485, "block_size_x": 32, "block_size_y": 1, "block_size_z": 1, "M_PER_BLOCK": 16, "N_PER_BLOCK": 32, "NBUFFER": 2, "ps_energy": 1.5499694163351836, "ps_power": 72.68037710229383, "core_freq": 1485.0, "temperature": 48.02456385780118, "time": 21.205723353794642, "times": [21.23468780517578, 21.185535430908203, 21.167104721069336, 21.182464599609375, 21.203968048095703, 21.23161506652832, 21.23468780517578], "compile_time": 1839.8479260504246, "verification_time": 0, "benchmark_time": 151.36692952364683, "TFLOPS": 25.92487908645778, "N_PER_WARP": 32, "M_PER_WARP": 16, "Watt": 72.68037710229383, "TFLOPS/J": 0.35468816874326914, "strategy_time": 0, "framework_time": 2.026887610554695, "timestamp": "2024-11-19 19:22:42.896272+00:00"},
"1485,32,1,1,16,32,4": {"nvml_gr_clock": 1485, "block_size_x": 32, "block_size_y": 1, "block_size_z": 1, "M_PER_BLOCK": 16, "N_PER_BLOCK": 32, "NBUFFER": 4, "ps_energy": 1.5286010150473999, "ps_power": 73.53031359591212, "core_freq": 1485.0, "temperature": 47.94781974092319, "time": 20.647643498012, "times": [20.65510368347168, 20.643840789794922, 20.643840789794922, 20.66636848449707, 20.6376953125, 20.6376953125, 20.64896011352539], "compile_time": 1164.5030211657286, "verification_time": 0, "benchmark_time": 147.23426569253206, "TFLOPS": 26.62559598827497, "N_PER_WARP": 32, "M_PER_WARP": 16, "Watt": 73.53031359591212, "TFLOPS/J": 0.3596463750031939, "strategy_time": 0, "framework_time": 2.113570459187031, "timestamp": "2024-11-19 19:22:44.210149+00:00"},
"1485,32,1,1,16,32,8": {"nvml_gr_clock": 1485, "block_size_x": 32, "block_size_y": 1, "block_size_z": 1, "M_PER_BLOCK": 16, "N_PER_BLOCK": 32, "NBUFFER": 8, "ps_energy": 2.789489108865033, "ps_power": 63.35031848895723, "core_freq": 1485.0, "temperature": 47.47851335656214, "time": 43.652095794677734, "times": [42.60249710083008, 39.2806396484375, 49.658878326416016, 39.799808502197266, 37.171199798583984, 47.39174270629883, 49.65990447998047], "compile_time": 1032.4424598366022, "verification_time": 0, "benchmark_time": 310.6395462527871, "TFLOPS": 12.59403022649439, "N_PER_WARP": 32, "M_PER_WARP": 16, "Watt": 63.35031848895723, "TFLOPS/J": 0.19708118312449, "strategy_time": 0, "framework_time": 2.2228239104151726, "timestamp": "2024-11-19 19:22:45.555488+00:00"},
"1485,32,1,1,16,64,1": {"nvml_gr_clock": 1485, "block_size_x": 32, "block_size_y": 1, "block_size_z": 1, "M_PER_BLOCK": 16, "N_PER_BLOCK": 64, "NBUFFER": 1, "ps_energy": 1.2311778457553584, "ps_power": 70.14239655589023, "core_freq": 1485.0, "temperature": 47.562464985994396, "time": 17.35972567967006, "times": [17.380352020263672, 17.371135711669922, 17.357824325561523, 17.364992141723633, 17.347583770751953, 17.342464447021484, 17.353727340698242], "compile_time": 1065.9005101770163, "verification_time": 0, "benchmark_time": 124.69968944787979, "TFLOPS": 31.66846205017041, "N_PER_WARP": 64, "M_PER_WARP": 16, "Watt": 70.14239655589023, "TFLOPS/J": 0.4465283515158698, "strategy_time": 0, "framework_time": 2.129598520696163, "timestamp": "2024-11-19 19:22:46.748246+00:00"},
"1485,32,1,1,16,64,2": {"nvml_gr_clock": 1485, "block_size_x": 32, "block_size_y": 1, "block_size_z": 1, "M_PER_BLOCK": 16, "N_PER_BLOCK": 64, "NBUFFER": 2, "ps_energy": 1.2830863620879671, "ps_power": 72.82450626295194, "core_freq": 1485.0, "temperature": 47.516250944822374, "time": 17.467099325997488, "times": [17.487871170043945, 17.490943908691406, 17.467391967773438, 17.44588851928711, 17.448959350585938, 17.46124839782715, 17.467391967773438], "compile_time": 1813.3715316653252, "verification_time": 0, "benchmark_time": 125.39949361234903, "TFLOPS": 31.473789873614596, "N_PER_WARP": 64, "M_PER_WARP": 16, "Watt": 72.82450626295194, "TFLOPS/J": 0.42846360941237194, "strategy_time": 0, "framework_time": 1.868894323706627, "timestamp": "2024-11-19 19:22:48.688907+00:00"},
"1485,32,1,1,16,64,4": {"nvml_gr_clock": 1485, "block_size_x": 32, "block_size_y": 1, "block_size_z": 1, "M_PER_BLOCK": 16, "N_PER_BLOCK": 64, "NBUFFER": 4, "ps_energy": 1.3977241462023764, "ps_power": 69.9621221432337, "core_freq": 1485.0, "temperature": 47.40609046126287, "time": 19.84000015258789, "times": [19.876863479614258, 19.83692741394043, 19.83283233642578, 19.83283233642578, 19.834880828857422, 19.8338565826416, 19.83180809020996], "compile_time": 1227.0264504477382, "verification_time": 0, "benchmark_time": 141.77105203270912, "TFLOPS": 27.709466212695112, "N_PER_WARP": 64, "M_PER_WARP": 16, "Watt": 69.9621221432337, "TFLOPS/J": 0.3933221125081722, "strategy_time": 0, "framework_time": 2.047535963356495, "timestamp": "2024-11-19 19:22:50.059786+00:00"},
"1485,32,1,1,16,64,8": {"nvml_gr_clock": 1485, "block_size_x": 32, "block_size_y": 1, "block_size_z": 1, "M_PER_BLOCK": 16, "N_PER_BLOCK": 64, "NBUFFER": 8, "ps_energy": 2.4243185885587275, "ps_power": 61.38264876275036, "core_freq": 1485.0, "temperature": 46.83418367346939, "time": 39.36841147286551, "times": [39.386112213134766, 39.365631103515625, 39.36460876464844, 39.365631103515625, 39.367679595947266, 39.36460876464844, 39.36460876464844], "compile_time": 1039.8931400850415, "verification_time": 0, "benchmark_time": 278.24517991393805, "TFLOPS": 13.964389044930517, "N_PER_WARP": 64, "M_PER_WARP": 16, "Watt": 61.38264876275036, "TFLOPS/J": 0.22676714870830292, "strategy_time": 0, "framework_time": 2.070409245789051, "timestamp": "2024-11-19 19:22:51.380020+00:00"},
"1485,32,1,1,16,128,1": {"nvml_gr_clock": 1485, "block_size_x": 32, "block_size_y": 1, "block_size_z": 1, "M_PER_BLOCK": 16, "N_PER_BLOCK": 128, "NBUFFER": 1, "ps_energy": 1.135432077673548, "ps_power": 71.17929801353237, "core_freq": 1485.0, "temperature": 47.31245421245421, "time": 15.784960065569196, "times": [15.80134391784668, 15.79212760925293, 15.774720191955566, 15.80339241027832, 15.777791976928711, 15.770624160766602, 15.774720191955566], "compile_time": 1097.2494455054402, "verification_time": 0, "benchmark_time": 113.34956157952547, "TFLOPS": 34.82782418228285, "N_PER_WARP": 128, "M_PER_WARP": 16, "Watt": 71.17929801353237, "TFLOPS/J": 0.48418203492579337, "strategy_time": 0, "framework_time": 2.0124316215515137, "timestamp": "2024-11-19 19:22:52.592649+00:00"},
"1485,32,1,1,16,128,2": {"nvml_gr_clock": 1485, "block_size_x": 32, "block_size_y": 1, "block_size_z": 1, "M_PER_BLOCK": 16, "N_PER_BLOCK": 128, "NBUFFER": 2, "ps_energy": 1.1917741693781798, "ps_power": 72.50981151789797, "core_freq": 1485.0, "temperature": 47.21450549450549, "time": 16.292863845825195, "times": [16.252927780151367, 16.35430335998535, 16.324607849121094, 16.25702476501465, 16.250879287719727, 16.338943481445312, 16.271360397338867], "compile_time": 1103.5565230995417, "verification_time": 0, "benchmark_time": 116.80247914046049, "TFLOPS": 33.742122876014015, "N_PER_WARP": 128, "M_PER_WARP": 16, "Watt": 72.50981151789797, "TFLOPS/J": 0.4612919360174089, "strategy_time": 0, "framework_time": 1.879713498055935, "timestamp": "2024-11-19 19:22:53.814908+00:00"},
"1485,32,1,1,16,128,4": {"nvml_gr_clock": 1485, "block_size_x": 32, "block_size_y": 1, "block_size_z": 1, "M_PER_BLOCK": 16, "N_PER_BLOCK": 128, "NBUFFER": 4, "ps_energy": 1.797740683200118, "ps_power": 57.160867636954876, "core_freq": 1485.0, "temperature": 46.704744069912614, "time": 31.295049122401647, "times": [31.333375930786133, 31.288320541381836, 31.290367126464844, 31.289344787597656, 31.285247802734375, 31.293439865112305, 31.285247802734375], "compile_time": 1129.2868563905358, "verification_time": 0, "benchmark_time": 222.11307659745216, "TFLOPS": 17.566862149274385, "N_PER_WARP": 128, "M_PER_WARP": 16, "Watt": 57.160867636954876, "TFLOPS/J": 0.3058037341121924, "strategy_time": 0, "framework_time": 1.8954118713736534, "timestamp": "2024-11-19 19:22:55.168229+00:00"},
"1485,32,1,1,16,256,1": {"nvml_gr_clock": 1485, "block_size_x": 32, "block_size_y": 1, "block_size_z": 1, "M_PER_BLOCK": 16, "N_PER_BLOCK": 256, "NBUFFER": 1, "ps_energy": 1.5246287361620878, "ps_power": 68.19586129728934, "core_freq": 1485.0, "temperature": 46.76459746928297, "time": 22.229430879865372, "times": [22.29862403869629, 22.190080642700195, 22.23923110961914, 22.133760452270508, 22.220800399780273, 22.227968215942383, 22.295551300048828], "compile_time": 1421.323163434863, "verification_time": 0, "benchmark_time": 158.13484508544207, "TFLOPS": 24.73098914943204, "N_PER_WARP": 256, "M_PER_WARP": 16, "Watt": 68.19586129728934, "TFLOPS/J": 0.36058340030497354, "strategy_time": 0, "framework_time": 2.1783923730254173, "timestamp": "2024-11-19 19:22:56.749891+00:00"},
"1485,32,1,1,16,256,2": {"nvml_gr_clock": 1485, "block_size_x": 32, "block_size_y": 1, "block_size_z": 1, "M_PER_BLOCK": 16, "N_PER_BLOCK": 256, "NBUFFER": 2, "ps_energy": 1.6430566764577017, "ps_power": 49.833875511829696, "core_freq": 1485.0, "temperature": 46.45636229749631, "time": 32.8630861554827, "times": [32.88576126098633, 32.86016082763672, 32.86016082763672, 32.85811233520508, 32.85811233520508, 32.86016082763672, 32.859134674072266], "compile_time": 1416.2348983809352, "verification_time": 0, "benchmark_time": 232.54999052733183, "TFLOPS": 16.72867275115249, "N_PER_WARP": 256, "M_PER_WARP": 16, "Watt": 49.833875511829696, "TFLOPS/J": 0.33459333555871573, "strategy_time": 0, "framework_time": 1.8336186185479164, "timestamp": "2024-11-19 19:22:58.400534+00:00"},
"1485,32,1,1,32,16,1": {"nvml_gr_clock": 1485, "block_size_x": 32, "block_size_y": 1, "block_size_z": 1, "M_PER_BLOCK": 32, "N_PER_BLOCK": 16, "NBUFFER": 1, "ps_energy": 1.4626530679108458, "ps_power": 70.11121253344444, "core_freq": 1485.0, "temperature": 46.71147565884407, "time": 20.733951568603516, "times": [20.766719818115234, 20.742143630981445, 20.725759506225586, 20.716543197631836, 20.750335693359375, 20.716543197631836, 20.719615936279297], "compile_time": 1015.8932721242309, "verification_time": 0, "benchmark_time": 147.73043058812618, "TFLOPS": 26.514763096122515, "N_PER_WARP": 16, "M_PER_WARP": 32, "Watt": 70.11121253344444, "TFLOPS/J": 0.37586207279709455, "strategy_time": 0, "framework_time": 1.858685165643692, "timestamp": "2024-11-19 19:22:59.566057+00:00"},
"1485,32,1,1,32,16,2": {"nvml_gr_clock": 1485, "block_size_x": 32, "block_size_y": 1, "block_size_z": 1, "M_PER_BLOCK": 32, "N_PER_BLOCK": 16, "NBUFFER": 2, "ps_energy": 1.5067811127343507, "ps_power": 71.55738341074219, "core_freq": 1485.0, "temperature": 46.74375, "time": 20.82216235569545, "times": [20.86092758178711, 20.802560806274414, 20.833280563354492, 20.83123207092285, 20.816896438598633, 20.8035831451416, 20.806655883789062], "compile_time": 1021.0095793008804, "verification_time": 0, "benchmark_time": 149.11719597876072, "TFLOPS": 26.402436235813244, "N_PER_WARP": 16, "M_PER_WARP": 32, "Watt": 71.55738341074219, "TFLOPS/J": 0.364854463094749, "strategy_time": 0, "framework_time": 1.9718054682016373, "timestamp": "2024-11-19 19:23:00.738174+00:00"},
"1485,32,1,1,32,16,4": {"nvml_gr_clock": 1485, "block_size_x": 32, "block_size_y": 1, "block_size_z": 1, "M_PER_BLOCK": 32, "N_PER_BLOCK": 16, "NBUFFER": 4, "ps_energy": 1.5381842667667018, "ps_power": 72.05636302728571, "core_freq": 1485.0, "temperature": 46.62087912087912, "time": 21.133458273751394, "times": [21.383167266845703, 21.147647857666016, 21.07801628112793, 21.204992294311523, 21.020671844482422, 21.04319953918457, 21.0565128326416], "compile_time": 1038.8734685257077, "verification_time": 0, "benchmark_time": 151.37043595314026, "TFLOPS": 26.01352825300812, "N_PER_WARP": 16, "M_PER_WARP": 32, "Watt": 72.05636302728571, "TFLOPS/J": 0.3574056930406649, "strategy_time": 0, "framework_time": 1.954483799636364, "timestamp": "2024-11-19 19:23:01.930401+00:00"},
"1485,32,1,1,32,16,8": {"nvml_gr_clock": 1485, "block_size_x": 32, "block_size_y": 1, "block_size_z": 1, "M_PER_BLOCK": 32, "N_PER_BLOCK": 16, "NBUFFER": 8, "ps_energy": 1.962292917117598, "ps_power": 64.68600093093049, "core_freq": 1485.0, "temperature": 46.4284267631103, "time": 30.162943976266043, "times": [30.18342399597168, 30.15987205505371, 30.16192054748535, 30.15884780883789, 30.15679931640625, 30.15884780883789, 30.16089630126953], "compile_time": 1754.8648603260517, "verification_time": 0, "benchmark_time": 214.62619956582785, "TFLOPS": 18.226198819338716, "N_PER_WARP": 16, "M_PER_WARP": 32, "Watt": 64.68600093093049, "TFLOPS/J": 0.28015991348301533, "strategy_time": 0, "framework_time": 2.2173235192894936, "timestamp": "2024-11-19 19:23:03.902135+00:00"},
"1485,32,1,1,32,32,1": {"nvml_gr_clock": 1485, "block_size_x": 32, "block_size_y": 1, "block_size_z": 1, "M_PER_BLOCK": 32, "N_PER_BLOCK": 32, "NBUFFER": 1, "ps_energy": 0.9999704275779615, "ps_power": 71.43108868582011, "core_freq": 1485.0, "temperature": 46.36330827067669, "time": 13.843748637608119, "times": [13.86188793182373, 13.854720115661621, 13.854720115661621, 13.846528053283691, 13.830143928527832, 13.830143928527832, 13.828096389770508], "compile_time": 1832.4636118486524, "verification_time": 0, "benchmark_time": 100.10688751935959, "TFLOPS": 39.71148482099175, "N_PER_WARP": 32, "M_PER_WARP": 32, "Watt": 71.43108868582011, "TFLOPS/J": 0.5497720719797375, "strategy_time": 0, "framework_time": 2.1730484440922737, "timestamp": "2024-11-19 19:23:05.836904+00:00"},
"1485,32,1,1,32,32,2": {"nvml_gr_clock": 1485, "block_size_x": 32, "block_size_y": 1, "block_size_z": 1, "M_PER_BLOCK": 32, "N_PER_BLOCK": 32, "NBUFFER": 2, "ps_energy": 1.0254837918221906, "ps_power": 72.6344265074866, "core_freq": 1485.0, "temperature": 46.327318295739346, "time": 13.875492640904017, "times": [13.898752212524414, 13.880319595336914, 13.873151779174805, 13.867008209228516, 13.863936424255371, 13.87929630279541, 13.865983963012695], "compile_time": 1153.1869377940893, "verification_time": 0, "benchmark_time": 100.4286864772439, "TFLOPS": 39.62063388418779, "N_PER_WARP": 32, "M_PER_WARP": 32, "Watt": 72.6344265074866, "TFLOPS/J": 0.5360941033608482, "strategy_time": 0, "framework_time": 2.1431446075439453, "timestamp": "2024-11-19 19:23:07.092685+00:00"},
"1485,32,1,1,32,32,4": {"nvml_gr_clock": 1485, "block_size_x": 32, "block_size_y": 1, "block_size_z": 1, "M_PER_BLOCK": 32, "N_PER_BLOCK": 32, "NBUFFER": 4, "ps_energy": 1.133881144176647, "ps_power": 70.18375391097025, "core_freq": 1485.0, "temperature": 46.19036894036894, "time": 16.031305040631974, "times": [16.052223205566406, 16.028671264648438, 16.03481674194336, 16.02457618713379, 16.0184326171875, 16.036863327026367, 16.02355194091797], "compile_time": 1047.7774366736412, "verification_time": 0, "benchmark_time": 114.81470242142677, "TFLOPS": 34.29264258241124, "N_PER_WARP": 32, "M_PER_WARP": 32, "Watt": 70.18375391097025, "TFLOPS/J": 0.4848443037538983, "strategy_time": 0, "framework_time": 3.4046275541186333, "timestamp": "2024-11-19 19:23:08.258701+00:00"},
"1485,32,1,1,32,32,8": {"nvml_gr_clock": 1485, "block_size_x": 32, "block_size_y": 1, "block_size_z": 1, "M_PER_BLOCK": 32, "N_PER_BLOCK": 32, "NBUFFER": 8, "ps_energy": 1.6237590857324125, "ps_power": 63.807569093379065, "core_freq": 1485.0, "temperature": 45.82251082251082, "time": 25.30581964765276, "times": [25.32044792175293, 25.2989444732666, 25.299968719482422, 25.30713653564453, 25.32352066040039, 25.29587173461914, 25.29484748840332], "compile_time": 1049.9565275385976, "verification_time": 0, "benchmark_time": 179.9309654161334, "TFLOPS": 21.724481622905763, "N_PER_WARP": 32, "M_PER_WARP": 32, "Watt": 63.807569093379065, "TFLOPS/J": 0.33856981538614594, "strategy_time": 0, "framework_time": 1.9706739112734795, "timestamp": "2024-11-19 19:23:09.490582+00:00"},
"1485,32,1,1,32,64,1": {"nvml_gr_clock": 1485, "block_size_x": 32, "block_size_y": 1, "block_size_z": 1, "M_PER_BLOCK": 32, "N_PER_BLOCK": 64, "NBUFFER": 1, "ps_energy": 0.7358463710072881, "ps_power": 67.62736192479277, "core_freq": 1485.0, "temperature": 45.99337557603686, "time": 10.704018320356097, "times": [10.72435188293457, 10.698752403259277, 10.700799942016602, 10.699775695800781, 10.701824188232422, 10.704895973205566, 10.697728157043457], "compile_time": 1164.9807831272483, "verification_time": 0, "benchmark_time": 77.79150921851397, "TFLOPS": 51.359760179269855, "N_PER_WARP": 64, "M_PER_WARP": 32, "Watt": 67.62736192479277, "TFLOPS/J": 0.7471067814541889, "strategy_time": 0, "framework_time": 1.9568568095564842, "timestamp": "2024-11-19 19:23:10.735333+00:00"},
"1485,32,1,1,32,64,2": {"nvml_gr_clock": 1485, "block_size_x": 32, "block_size_y": 1, "block_size_z": 1, "M_PER_BLOCK": 32, "N_PER_BLOCK": 64, "NBUFFER": 2, "ps_energy": 0.7985080010399608, "ps_power": 74.09029445864394, "core_freq": 1485.0, "temperature": 45.936961451247164, "time": 10.556854929242816, "times": [10.577919960021973, 10.554368019104004, 10.556415557861328, 10.53593635559082, 10.547200202941895, 10.574848175048828, 10.55129623413086], "compile_time": 1146.1525950580835, "verification_time": 0, "benchmark_time": 77.14658696204424, "TFLOPS": 52.07571929071028, "N_PER_WARP": 64, "M_PER_WARP": 32, "Watt": 74.09029445864394, "TFLOPS/J": 0.688478779388571, "strategy_time": 0, "framework_time": 1.8402114510536194, "timestamp": "2024-11-19 19:23:11.960490+00:00"},
"1485,32,1,1,32,64,4": {"nvml_gr_clock": 1485, "block_size_x": 32, "block_size_y": 1, "block_size_z": 1, "M_PER_BLOCK": 32, "N_PER_BLOCK": 64, "NBUFFER": 4, "ps_energy": 0.9570420259689983, "ps_power": 63.991942467572855, "core_freq": 1485.0, "temperature": 45.706344704643065, "time": 14.89100796835763, "times": [14.9104642868042, 14.88588809967041, 14.888959884643555, 14.889984130859375, 14.88486385345459, 14.887935638427734, 14.888959884643555], "compile_time": 1149.452026002109, "verification_time": 0, "benchmark_time": 106.3916115090251, "TFLOPS": 36.918643456251814, "N_PER_WARP": 64, "M_PER_WARP": 32, "Watt": 63.991942467572855, "TFLOPS/J": 0.5744322599954543, "strategy_time": 0, "framework_time": 1.8439264968037605, "timestamp": "2024-11-19 19:23:13.218195+00:00"},
"1485,32,1,1,32,64,8": {"nvml_gr_clock": 1485, "block_size_x": 32, "block_size_y": 1, "block_size_z": 1, "M_PER_BLOCK": 32, "N_PER_BLOCK": 64, "NBUFFER": 8, "ps_energy": 1.6065114177305466, "ps_power": 53.59867042165153, "core_freq": 1485.0, "temperature": 45.47163704191354, "time": 29.8697874886649, "times": [29.888511657714844, 29.867008209228516, 29.865983963012695, 29.868032455444336, 29.865983963012695, 29.867008209228516, 29.865983963012695], "compile_time": 1151.8521597608924, "verification_time": 0, "benchmark_time": 211.56731713563204, "TFLOPS": 18.405079517108163, "N_PER_WARP": 64, "M_PER_WARP": 32, "Watt": 53.59867042165153, "TFLOPS/J": 0.3422047349433829, "strategy_time": 0, "framework_time": 1.7867814749479294, "timestamp": "2024-11-19 19:23:14.583421+00:00"},
"1485,32,1,1,32,128,1": {"nvml_gr_clock": 1485, "block_size_x": 32, "block_size_y": 1, "block_size_z": 1, "M_PER_BLOCK": 32, "N_PER_BLOCK": 128, "NBUFFER": 1, "ps_energy": 1.7123485449521598, "ps_power": 57.75967772511956, "core_freq": 1485.0, "temperature": 45.990073249809875, "time": 29.47774178641183, "times": [29.56902313232422, 29.477888107299805, 29.447168350219727, 29.468671798706055, 29.485055923461914, 29.455360412597656, 29.441024780273438], "compile_time": 1327.958825044334, "verification_time": 0, "benchmark_time": 209.23453848809004, "TFLOPS": 18.649861915182985, "N_PER_WARP": 128, "M_PER_WARP": 32, "Watt": 57.75967772511956, "TFLOPS/J": 0.32105368705958126, "strategy_time": 0, "framework_time": 2.1494580432772636, "timestamp": "2024-11-19 19:23:16.122782+00:00"},
"1485,32,1,1,32,128,2": {"nvml_gr_clock": 1485, "block_size_x": 32, "block_size_y": 1, "block_size_z": 1, "M_PER_BLOCK": 32, "N_PER_BLOCK": 128, "NBUFFER": 2, "ps_energy": 2.5092666019049505, "ps_power": 54.10411651066788, "core_freq": 1485.0, "temperature": 45.713235294117645, "time": 46.26768003191267, "times": [46.31961441040039, 46.260223388671875, 46.34624099731445, 46.441471099853516, 46.26736068725586, 46.092288970947266, 46.14656066894531], "compile_time": 1334.7310507670045, "verification_time": 0, "benchmark_time": 326.398522593081, "TFLOPS": 11.882070021855677, "N_PER_WARP": 128, "M_PER_WARP": 32, "Watt": 54.10411651066788, "TFLOPS/J": 0.21909023675309905, "strategy_time": 0, "framework_time": 1.8389848992228508, "timestamp": "2024-11-19 19:23:17.785772+00:00"},
"1485,32,1,1,32,128,4": {"nvml_gr_clock": 1485, "block_size_x": 32, "block_size_y": 1, "block_size_z": 1, "M_PER_BLOCK": 32, "N_PER_BLOCK": 128, "NBUFFER": 4, "ps_energy": 3.3143006757120475, "ps_power": 50.136290180374644, "core_freq": 1485.0, "temperature": 45.50203683812707, "time": 65.96534837995257, "times": [65.92716979980469, 65.98860931396484, 65.78482818603516, 65.95276641845703, 65.84729766845703, 66.11968231201172, 66.1370849609375], "compile_time": 1338.388998992741, "verification_time": 0, "benchmark_time": 464.51074350625277, "TFLOPS": 8.334009103104737, "N_PER_WARP": 128, "M_PER_WARP": 32, "Watt": 50.136290180374644, "TFLOPS/J": 0.16587385022630452, "strategy_time": 0, "framework_time": 2.016497775912285, "timestamp": "2024-11-19 19:23:19.590707+00:00"},
"1485,32,1,1,32,256,1": {"nvml_gr_clock": 1485, "block_size_x": 32, "block_size_y": 1, "block_size_z": 1, "M_PER_BLOCK": 32, "N_PER_BLOCK": 256, "NBUFFER": 1, "ps_energy": 4.386906094523998, "ps_power": 68.98159353040907, "core_freq": 1485.0, "temperature": 46.09398351393471, "time": 63.80061285836356, "times": [66.06336212158203, 63.4439697265625, 63.41734313964844, 63.340545654296875, 63.46137619018555, 63.448062896728516, 63.429630279541016], "compile_time": 2061.5736693143845, "verification_time": 0, "benchmark_time": 449.339852668345, "TFLOPS": 8.616779514460935, "N_PER_WARP": 256, "M_PER_WARP": 32, "Watt": 68.98159353040907, "TFLOPS/J": 0.12531743375456303, "strategy_time": 0, "framework_time": 3.2028313726186752, "timestamp": "2024-11-19 19:23:22.104844+00:00"},
"1485,32,1,1,32,256,2": {"nvml_gr_clock": 1485, "block_size_x": 32, "block_size_y": 1, "block_size_z": 1, "M_PER_BLOCK": 32, "N_PER_BLOCK": 256, "NBUFFER": 2, "ps_energy": 4.985131665396693, "ps_power": 46.40419944635709, "core_freq": 1485.0, "temperature": 45.47343569779167, "time": 107.74191502162388, "times": [110.0953598022461, 107.37356567382812, 107.11859130859375, 107.4493408203125, 107.34182739257812, 107.4155502319336, 107.399169921875], "compile_time": 2095.7199996337295, "verification_time": 0, "benchmark_time": 756.6574960947037, "TFLOPS": 5.102524990182917, "N_PER_WARP": 256, "M_PER_WARP": 32, "Watt": 46.40419944635709, "TFLOPS/J": 0.11027909607764654, "strategy_time": 0, "framework_time": 1.986525021493435, "timestamp": "2024-11-19 19:23:24.959227+00:00"},
"1485,32,1,1,64,16,1": {"nvml_gr_clock": 1485, "block_size_x": 32, "block_size_y": 1, "block_size_z": 1, "M_PER_BLOCK": 64, "N_PER_BLOCK": 16, "NBUFFER": 1, "ps_energy": 1.134679066041112, "ps_power": 65.23577923149388, "core_freq": 1485.0, "temperature": 45.55517171306645, "time": 17.25761822291783, "times": [17.271808624267578, 17.267711639404297, 17.251327514648438, 17.25644874572754, 17.250303268432617, 17.257471084594727, 17.24825668334961], "compile_time": 1804.7012202441692, "verification_time": 0, "benchmark_time": 124.01952221989632, "TFLOPS": 31.855833567921525, "N_PER_WARP": 16, "M_PER_WARP": 64, "Watt": 65.23577923149388, "TFLOPS/J": 0.48450335459707966, "strategy_time": 0, "framework_time": 1.8856832757592201, "timestamp": "2024-11-19 19:23:26.889854+00:00"},
"1485,32,1,1,64,16,2": {"nvml_gr_clock": 1485, "block_size_x": 32, "block_size_y": 1, "block_size_z": 1, "M_PER_BLOCK": 64, "N_PER_BLOCK": 16, "NBUFFER": 2, "ps_energy": 1.1903932803466952, "ps_power": 68.26845024914931, "core_freq": 1485.0, "temperature": 45.567567567567565, "time": 17.2672734941755, "times": [17.292287826538086, 17.26464080810547, 17.260543823242188, 17.271808624267578, 17.25644874572754, 17.26464080810547, 17.260543823242188], "compile_time": 1207.5831964612007, "verification_time": 0, "benchmark_time": 123.74040205031633, "TFLOPS": 31.838020870720587, "N_PER_WARP": 16, "M_PER_WARP": 64, "Watt": 68.26845024914931, "TFLOPS/J": 0.4618270473837745, "strategy_time": 0, "framework_time": 1.985921524465084, "timestamp": "2024-11-19 19:23:28.223185+00:00"},
"1485,32,1,1,64,16,4": {"nvml_gr_clock": 1485, "block_size_x": 32, "block_size_y": 1, "block_size_z": 1, "M_PER_BLOCK": 64, "N_PER_BLOCK": 16, "NBUFFER": 4, "ps_energy": 1.3287320501691673, "ps_power": 63.06457828739663, "core_freq": 1485.0, "temperature": 45.451996927803386, "time": 20.913590567452566, "times": [20.938751220703125, 20.909055709838867, 20.909055709838867, 20.909055709838867, 20.910079956054688, 20.910079956054688, 20.909055709838867], "compile_time": 1042.031235061586, "verification_time": 0, "benchmark_time": 149.07956589013338, "TFLOPS": 26.287012367143443, "N_PER_WARP": 16, "M_PER_WARP": 64, "Watt": 63.06457828739663, "TFLOPS/J": 0.41374467773093, "strategy_time": 0, "framework_time": 2.0118998363614082, "timestamp": "2024-11-19 19:23:29.416326+00:00"},
"1485,32,1,1,64,16,8": {"nvml_gr_clock": 1485, "block_size_x": 32, "block_size_y": 1, "block_size_z": 1, "M_PER_BLOCK": 64, "N_PER_BLOCK": 16, "NBUFFER": 8, "ps_energy": 2.0167384591269575, "ps_power": 48.35507526542241, "core_freq": 1485.0, "temperature": 44.90119047619048, "time": 41.585079193115234, "times": [41.60512161254883, 41.58464050292969, 41.578495025634766, 41.58156967163086, 41.578495025634766, 41.58873748779297, 41.578495025634766], "compile_time": 1047.852074727416, "verification_time": 0, "benchmark_time": 293.70691161602736, "TFLOPS": 13.220025657159667, "N_PER_WARP": 16, "M_PER_WARP": 64, "Watt": 48.35507526542241, "TFLOPS/J": 0.2725964843879599, "strategy_time": 0, "framework_time": 1.9524507224559784, "timestamp": "2024-11-19 19:23:30.759860+00:00"},
"1485,32,1,1,64,32,1": {"nvml_gr_clock": 1485, "block_size_x": 32, "block_size_y": 1, "block_size_z": 1, "M_PER_BLOCK": 64, "N_PER_BLOCK": 32, "NBUFFER": 1, "ps_energy": 0.7143209485358771, "ps_power": 66.11566307976435, "core_freq": 1485.0, "temperature": 45.39019607843137, "time": 10.637165750776019, "times": [10.651647567749023, 10.64038372039795, 10.63424015045166, 10.639360427856445, 10.638336181640625, 10.629119873046875, 10.62707233428955], "compile_time": 1141.235237941146, "verification_time": 0, "benchmark_time": 77.28198915719986, "TFLOPS": 51.682546532462695, "N_PER_WARP": 32, "M_PER_WARP": 64, "Watt": 66.11566307976435, "TFLOPS/J": 0.7696201756574808, "strategy_time": 0, "framework_time": 1.9419211894273758, "timestamp": "2024-11-19 19:23:31.980360+00:00"},
"1485,32,1,1,64,32,2": {"nvml_gr_clock": 1485, "block_size_x": 32, "block_size_y": 1, "block_size_z": 1, "M_PER_BLOCK": 64, "N_PER_BLOCK": 32, "NBUFFER": 2, "ps_energy": 0.7844443802950016, "ps_power": 72.3809146445263, "core_freq": 1485.0, "temperature": 45.38095238095239, "time": 10.692900657653809, "times": [10.762240409851074, 10.687487602233887, 10.681344032287598, 10.671104431152344, 10.682368278503418, 10.677248001098633, 10.688511848449707], "compile_time": 1147.0298301428556, "verification_time": 0, "benchmark_time": 77.57508661597967, "TFLOPS": 51.413160141396574, "N_PER_WARP": 32, "M_PER_WARP": 64, "Watt": 72.3809146445263, "TFLOPS/J": 0.7008219163750735, "strategy_time": 0, "framework_time": 2.157404087483883, "timestamp": "2024-11-19 19:23:33.207146+00:00"},
"1485,32,1,1,64,32,4": {"nvml_gr_clock": 1485, "block_size_x": 32, "block_size_y": 1, "block_size_z": 1, "M_PER_BLOCK": 64, "N_PER_BLOCK": 32, "NBUFFER": 4, "ps_energy": 0.9383476746055034, "ps_power": 63.16523553521874, "core_freq": 1485.0, "temperature": 45.042857142857144, "time": 14.717069625854492, "times": [14.733311653137207, 14.714879989624023, 14.714879989624023, 14.713824272155762, 14.713855743408203, 14.714879989624023, 14.713855743408203], "compile_time": 1141.3661958649755, "verification_time": 0, "benchmark_time": 105.6304695084691, "TFLOPS": 37.35497812160962, "N_PER_WARP": 32, "M_PER_WARP": 64, "Watt": 63.16523553521874, "TFLOPS/J": 0.5858764600435827, "strategy_time": 0, "framework_time": 1.998094841837883, "timestamp": "2024-11-19 19:23:34.456158+00:00"},
"1485,32,1,1,64,32,8": {"nvml_gr_clock": 1485, "block_size_x": 32, "block_size_y": 1, "block_size_z": 1, "M_PER_BLOCK": 64, "N_PER_BLOCK": 32, "NBUFFER": 8, "ps_energy": 1.5524337452688997, "ps_power": 52.46188260033242, "core_freq": 1485.0, "temperature": 44.79967159277504, "time": 29.49719783238002, "times": [29.514751434326172, 29.493247985839844, 29.494272232055664, 29.494272232055664, 29.494272232055664, 29.494272232055664, 29.495296478271484], "compile_time": 1146.5349001809955, "verification_time": 0, "benchmark_time": 208.86203926056623, "TFLOPS": 18.637560659559174, "N_PER_WARP": 32, "M_PER_WARP": 64, "Watt": 52.46188260033242, "TFLOPS/J": 0.35412513774800475, "strategy_time": 0, "framework_time": 2.0173611119389534, "timestamp": "2024-11-19 19:23:35.813591+00:00"},
"1485,32,1,1,64,64,1": {"nvml_gr_clock": 1485, "block_size_x": 32, "block_size_y": 1, "block_size_z": 1, "M_PER_BLOCK": 64, "N_PER_BLOCK": 64, "NBUFFER": 1, "ps_energy": 1.2958516743400585, "ps_power": 68.67436649607208, "core_freq": 1485.0, "temperature": 45.39094559656746, "time": 18.735542842320033, "times": [18.685951232910156, 18.784255981445312, 18.752511978149414, 18.736127853393555, 18.752511978149414, 18.737152099609375, 18.700288772583008], "compile_time": 1286.3077213987708, "verification_time": 0, "benchmark_time": 133.73943511396646, "TFLOPS": 29.342934897312187, "N_PER_WARP": 64, "M_PER_WARP": 64, "Watt": 68.67436649607208, "TFLOPS/J": 0.42424285493011804, "strategy_time": 0, "framework_time": 2.035653218626976, "timestamp": "2024-11-19 19:23:37.235693+00:00"},
"1485,32,1,1,64,64,2": {"nvml_gr_clock": 1485, "block_size_x": 32, "block_size_y": 1, "block_size_z": 1, "M_PER_BLOCK": 64, "N_PER_BLOCK": 64, "NBUFFER": 2, "ps_energy": 1.2018790323997695, "ps_power": 67.17130576334787, "core_freq": 1485.0, "temperature": 45.340048840048844, "time": 17.788489477975027, "times": [17.81760025024414, 17.785856246948242, 17.763328552246094, 17.79097557067871, 17.771520614624023, 17.812480926513672, 17.777664184570312], "compile_time": 1287.4589962884784, "verification_time": 0, "benchmark_time": 127.01370846480131, "TFLOPS": 30.905143158371317, "N_PER_WARP": 64, "M_PER_WARP": 64, "Watt": 67.17130576334787, "TFLOPS/J": 0.4574135990960029, "strategy_time": 0, "framework_time": 1.8836092203855515, "timestamp": "2024-11-19 19:23:38.652070+00:00"},
"1485,32,1,1,64,64,4": {"nvml_gr_clock": 1485, "block_size_x": 32, "block_size_y": 1, "block_size_z": 1, "M_PER_BLOCK": 64, "N_PER_BLOCK": 64, "NBUFFER": 4, "ps_energy": 1.3517594244470144, "ps_power": 58.12250229634568, "core_freq": 1485.0, "temperature": 44.88396386222473, "time": 22.977097375052317, "times": [22.999040603637695, 22.987775802612305, 22.972415924072266, 22.980607986450195, 22.973440170288086, 22.960128784179688, 22.966272354125977], "compile_time": 2195.787318982184, "verification_time": 0, "benchmark_time": 164.91551510989666, "TFLOPS": 23.926251645906525, "N_PER_WARP": 64, "M_PER_WARP": 64, "Watt": 58.12250229634568, "TFLOPS/J": 0.4066964904741813, "strategy_time": 0, "framework_time": 2.0587481558322906, "timestamp": "2024-11-19 19:23:41.014872+00:00"},
"1485,32,1,1,64,128,1": {"nvml_gr_clock": 1485, "block_size_x": 32, "block_size_y": 1, "block_size_z": 1, "M_PER_BLOCK": 64, "N_PER_BLOCK": 128, "NBUFFER": 1, "ps_energy": 4.726872670293233, "ps_power": 66.52911181160346, "core_freq": 1485.0, "temperature": 45.28997029363598, "time": 70.83636801583427, "times": [70.6693115234375, 70.83110046386719, 71.25401306152344, 70.86796569824219, 70.5617904663086, 70.92940521240234, 70.7409896850586], "compile_time": 1915.6518187373877, "verification_time": 0, "benchmark_time": 499.6290560811758, "TFLOPS": 7.760926050939137, "N_PER_WARP": 128, "M_PER_WARP": 64, "Watt": 66.52911181160346, "TFLOPS/J": 0.11630434163014926, "strategy_time": 0, "framework_time": 1.9119950011372566, "timestamp": "2024-11-19 19:23:43.432085+00:00"},
"1485,32,1,1,64,128,2": {"nvml_gr_clock": 1485, "block_size_x": 32, "block_size_y": 1, "block_size_z": 1, "M_PER_BLOCK": 64, "N_PER_BLOCK": 128, "NBUFFER": 2, "ps_energy": 3.461952917146001, "ps_power": 66.05410581597194, "core_freq": 1485.0, "temperature": 45.44606763099914, "time": 52.28441619873047, "times": [52.368385314941406, 52.316158294677734, 52.159488677978516, 52.14003372192383, 52.31923294067383, 52.41139221191406, 52.276222229003906], "compile_time": 1897.6548435166478, "verification_time": 0, "benchmark_time": 368.6980465427041, "TFLOPS": 10.514716503640502, "N_PER_WARP": 128, "M_PER_WARP": 64, "Watt": 66.05410581597194, "TFLOPS/J": 0.15879933293293114, "strategy_time": 0, "framework_time": 1.9936272874474525, "timestamp": "2024-11-19 19:23:45.700450+00:00"},
"1485,32,1,1,64,128,4": {"nvml_gr_clock": 1485, "block_size_x": 32, "block_size_y": 1, "block_size_z": 1, "M_PER_BLOCK": 64, "N_PER_BLOCK": 128, "NBUFFER": 4, "ps_energy": 3.6655126830095077, "ps_power": 48.096043155166264, "core_freq": 1485.0, "temperature": 44.827275494672755, "time": 76.05218723842076, "times": [76.03404998779297, 76.06784057617188, 76.10470581054688, 76.042236328125, 75.99616241455078, 76.03097534179688, 76.08934020996094], "compile_time": 1897.0146598294377, "verification_time": 0, "benchmark_time": 535.2442115545273, "TFLOPS": 7.228665392154156, "N_PER_WARP": 128, "M_PER_WARP": 64, "Watt": 48.096043155166264, "TFLOPS/J": 0.14998060610627384, "strategy_time": 0, "framework_time": 1.8287179991602898, "timestamp": "2024-11-19 19:23:48.134555+00:00"},
"1485,32,1,1,64,256,1": {"nvml_gr_clock": 1485, "block_size_x": 32, "block_size_y": 1, "block_size_z": 1, "M_PER_BLOCK": 64, "N_PER_BLOCK": 256, "NBUFFER": 1, "ps_energy": 8.257697939470615, "ps_power": 62.73442938355652, "core_freq": 1375.5471821756223, "temperature": 43.084850044818516, "time": 131.83531842912947, "times": [133.17324829101562, 131.64544677734375, 132.03762817382812, 130.3756866455078, 131.60140991210938, 131.67308044433594, 132.34072875976562], "compile_time": 23327.98064313829, "verification_time": 0, "benchmark_time": 925.8662136271596, "TFLOPS": 4.170019236412218, "N_PER_WARP": 256, "M_PER_WARP": 64, "Watt": 62.73442938355652, "TFLOPS/J": 0.06657494835942664, "strategy_time": 0, "framework_time": 1.9847694784402847, "timestamp": "2024-11-19 19:24:12.390410+00:00"},
"1485,32,1,1,64,256,2": {"nvml_gr_clock": 1485, "block_size_x": 32, "block_size_y": 1, "block_size_z": 1, "M_PER_BLOCK": 64, "N_PER_BLOCK": 256, "NBUFFER": 2, "ps_energy": 5.153077129193337, "ps_power": 62.941212918357294, "core_freq": 1391.5934065934066, "temperature": 42.06706953299907, "time": 81.72149113246373, "times": [81.84627532958984, 81.94662475585938, 81.79199981689453, 81.5656967163086, 81.79302215576172, 81.54521942138672, 81.56159973144531], "compile_time": 23285.56516766548, "verification_time": 0, "benchmark_time": 575.1314135268331, "TFLOPS": 6.72718774791923, "N_PER_WARP": 256, "M_PER_WARP": 64, "Watt": 62.941212918357294, "TFLOPS/J": 0.10668495737692535, "strategy_time": 0, "framework_time": 2.5648213922977448, "timestamp": "2024-11-19 19:24:36.253701+00:00"},
"1485,32,1,1,128,16,1": {"nvml_gr_clock": 1485, "block_size_x": 32, "block_size_y": 1, "block_size_z": 1, "M_PER_BLOCK": 128, "N_PER_BLOCK": 16, "NBUFFER": 1, "ps_energy": 0.9325571539381079, "ps_power": 58.63333027830413, "core_freq": 1485.0, "temperature": 42.1003861003861, "time": 15.83645248413086, "times": [15.860735893249512, 15.828991889953613, 15.814656257629395, 15.859711647033691, 15.845376014709473, 15.823871612548828, 15.821824073791504], "compile_time": 1166.752896271646, "verification_time": 0, "benchmark_time": 113.03815059363842, "TFLOPS": 34.714581086824246, "N_PER_WARP": 16, "M_PER_WARP": 128, "Watt": 58.63333027830413, "TFLOPS/J": 0.5895143386830811, "strategy_time": 0, "framework_time": 2.0973579958081245, "timestamp": "2024-11-19 19:24:37.535614+00:00"},
"1485,32,1,1,128,16,2": {"nvml_gr_clock": 1485, "block_size_x": 32, "block_size_y": 1, "block_size_z": 1, "M_PER_BLOCK": 128, "N_PER_BLOCK": 16, "NBUFFER": 2, "ps_energy": 1.0206902324149658, "ps_power": 63.41644690890326, "core_freq": 1485.0, "temperature": 42.176209755157124, "time": 15.965183939252581, "times": [16.00204849243164, 15.959039688110352, 15.97439956665039, 15.960063934326172, 15.940608024597168, 15.928319931030273, 15.99180793762207], "compile_time": 1149.2012590169907, "verification_time": 0, "benchmark_time": 114.30141422897577, "TFLOPS": 34.43466833703998, "N_PER_WARP": 16, "M_PER_WARP": 128, "Watt": 63.41644690890326, "TFLOPS/J": 0.5386118103504046, "strategy_time": 0, "framework_time": 1.8574530258774757, "timestamp": "2024-11-19 19:24:38.800992+00:00"},
"1485,32,1,1,128,16,4": {"nvml_gr_clock": 1485, "block_size_x": 32, "block_size_y": 1, "block_size_z": 1, "M_PER_BLOCK": 128, "N_PER_BLOCK": 16, "NBUFFER": 4, "ps_energy": 1.444483729541584, "ps_power": 46.83429464973168, "core_freq": 1485.0, "temperature": 41.79905808477237, "time": 30.605750492640905, "times": [30.623743057250977, 30.60326385498047, 30.60326385498047, 30.60223960876465, 30.60223960876465, 30.60326385498047, 30.60223960876465], "compile_time": 1148.9804973825812, "verification_time": 0, "benchmark_time": 217.708270996809, "TFLOPS": 17.962500675165206, "N_PER_WARP": 16, "M_PER_WARP": 128, "Watt": 46.83429464973168, "TFLOPS/J": 0.38058982780129236, "strategy_time": 0, "framework_time": 2.1630022674798965, "timestamp": "2024-11-19 19:24:40.169861+00:00"},
"1485,32,1,1,128,32,1": {"nvml_gr_clock": 1485, "block_size_x": 32, "block_size_y": 1, "block_size_z": 1, "M_PER_BLOCK": 128, "N_PER_BLOCK": 32, "NBUFFER": 1, "ps_energy": 1.111926519924769, "ps_power": 63.511019005125874, "core_freq": 1485.0, "temperature": 42.430858057508715, "time": 17.39833586556571, "times": [17.327104568481445, 17.391584396362305, 17.40287971496582, 17.39366340637207, 17.41926383972168, 17.428447723388672, 17.42540740966797], "compile_time": 1289.0316611155868, "verification_time": 0, "benchmark_time": 124.17847663164139, "TFLOPS": 31.59818376515314, "N_PER_WARP": 32, "M_PER_WARP": 128, "Watt": 63.511019005125874, "TFLOPS/J": 0.49441739542752833, "strategy_time": 0, "framework_time": 1.933974213898182, "timestamp": "2024-11-19 19:24:41.585026+00:00"},
"1485,32,1,1,128,32,2": {"nvml_gr_clock": 1485, "block_size_x": 32, "block_size_y": 1, "block_size_z": 1, "M_PER_BLOCK": 128, "N_PER_BLOCK": 32, "NBUFFER": 2, "ps_energy": 1.1860850745568834, "ps_power": 59.725698450736175, "core_freq": 1485.0, "temperature": 42.284396838125794, "time": 19.725897107805526, "times": [19.744768142700195, 19.706880569458008, 19.718143463134766, 19.723264694213867, 19.749887466430664, 19.725311279296875, 19.713024139404297], "compile_time": 1280.735676176846, "verification_time": 0, "benchmark_time": 141.2983387708664, "TFLOPS": 27.869749643500977, "N_PER_WARP": 32, "M_PER_WARP": 128, "Watt": 59.725698450736175, "TFLOPS/J": 0.4635045374745876, "strategy_time": 0, "framework_time": 1.9043097272515297, "timestamp": "2024-11-19 19:24:43.008984+00:00"},
"1485,32,1,1,128,32,4": {"nvml_gr_clock": 1485, "block_size_x": 32, "block_size_y": 1, "block_size_z": 1, "M_PER_BLOCK": 128, "N_PER_BLOCK": 32, "NBUFFER": 4, "ps_energy": 1.4834350208191478, "ps_power": 48.522278291196244, "core_freq": 1485.0, "temperature": 41.85178571428571, "time": 30.377403259277344, "times": [30.41484832763672, 30.36569595336914, 30.37491226196289, 30.37183952331543, 30.369823455810547, 30.35545539855957, 30.38924789428711], "compile_time": 2187.1706834062934, "verification_time": 0, "benchmark_time": 216.03513322770596, "TFLOPS": 18.097524966032214, "N_PER_WARP": 32, "M_PER_WARP": 128, "Watt": 48.522278291196244, "TFLOPS/J": 0.37059649136800527, "strategy_time": 0, "framework_time": 2.1415529772639275, "timestamp": "2024-11-19 19:24:45.414363+00:00"},
"1485,32,1,1,128,64,1": {"nvml_gr_clock": 1485, "block_size_x": 32, "block_size_y": 1, "block_size_z": 1, "M_PER_BLOCK": 128, "N_PER_BLOCK": 64, "NBUFFER": 1, "ps_energy": 5.553526356518238, "ps_power": 67.64253822167287, "core_freq": 1485.0, "temperature": 42.71376393318593, "time": 81.92877415248326, "times": [82.1207046508789, 81.90054321289062, 82.08589172363281, 81.64147186279297, 81.76640319824219, 81.87596893310547, 82.11043548583984], "compile_time": 1901.3333469629288, "verification_time": 0, "benchmark_time": 576.4496559277177, "TFLOPS": 6.710167698406079, "N_PER_WARP": 64, "M_PER_WARP": 128, "Watt": 67.64253822167287, "TFLOPS/J": 0.09899220397914296, "strategy_time": 0, "framework_time": 1.8913159146904945, "timestamp": "2024-11-19 19:24:47.894062+00:00"},
"1485,32,1,1,128,64,2": {"nvml_gr_clock": 1485, "block_size_x": 32, "block_size_y": 1, "block_size_z": 1, "M_PER_BLOCK": 128, "N_PER_BLOCK": 64, "NBUFFER": 2, "ps_energy": 3.9302923362826863, "ps_power": 64.9238764119613, "core_freq": 1485.0, "temperature": 42.918934731787445, "time": 60.378404889787944, "times": [60.38016128540039, 60.309505462646484, 60.41292953491211, 60.426239013671875, 60.279808044433594, 60.414974212646484, 60.42521667480469], "compile_time": 1911.388048902154, "verification_time": 0, "benchmark_time": 425.50947424024343, "TFLOPS": 9.105172865886402, "N_PER_WARP": 64, "M_PER_WARP": 128, "Watt": 64.9238764119613, "TFLOPS/J": 0.13987657071025028, "strategy_time": 0, "framework_time": 1.81666761636734, "timestamp": "2024-11-19 19:24:50.232794+00:00"},
"1485,32,1,1,128,64,4": {"nvml_gr_clock": 1485, "block_size_x": 32, "block_size_y": 1, "block_size_z": 1, "M_PER_BLOCK": 128, "N_PER_BLOCK": 64, "NBUFFER": 4, "ps_energy": 3.6732727707990955, "ps_power": 47.9230197002734, "core_freq": 1485.0, "temperature": 42.68310155920775, "time": 76.48694937569755, "times": [76.50099182128906, 76.43852996826172, 76.5132827758789, 76.5143051147461, 76.5327377319336, 76.47232055664062, 76.43647766113281], "compile_time": 1912.5472009181976, "verification_time": 0, "benchmark_time": 538.4805593639612, "TFLOPS": 7.187576683018761, "N_PER_WARP": 64, "M_PER_WARP": 128, "Watt": 47.9230197002734, "TFLOPS/J": 0.14966375986513095, "strategy_time": 0, "framework_time": 1.9221724942326546, "timestamp": "2024-11-19 19:24:52.685764+00:00"},
"1485,32,1,1,128,128,1": {"nvml_gr_clock": 1485, "block_size_x": 32, "block_size_y": 1, "block_size_z": 1, "M_PER_BLOCK": 128, "N_PER_BLOCK": 128, "NBUFFER": 1, "ps_energy": 9.373801943289306, "ps_power": 61.7035454731472, "core_freq": 1485.0, "temperature": 41.245830796177074, "time": 151.5654580252511, "times": [151.6615753173828, 150.76760864257812, 151.55711364746094, 151.7987823486328, 151.87149047851562, 151.6441650390625, 151.657470703125], "compile_time": 24334.402287378907, "verification_time": 0, "benchmark_time": 1065.4885033145547, "TFLOPS": 3.6271840632475087, "N_PER_WARP": 128, "M_PER_WARP": 128, "Watt": 61.7035454731472, "TFLOPS/J": 0.05864811494993977, "strategy_time": 0, "framework_time": 1.849035732448101, "timestamp": "2024-11-19 19:25:18.087530+00:00"},
"1485,32,1,1,128,128,2": {"nvml_gr_clock": 1485, "block_size_x": 32, "block_size_y": 1, "block_size_z": 1, "M_PER_BLOCK": 128, "N_PER_BLOCK": 128, "NBUFFER": 2, "ps_energy": 5.620449299234159, "ps_power": 65.49938824987866, "core_freq": 1456.7972350230414, "temperature": 40.60412638173549, "time": 86.12322780064174, "times": [90.09254455566406, 85.64530944824219, 86.05184173583984, 85.70470428466797, 84.38169860839844, 85.897216796875, 85.08927917480469], "compile_time": 23806.198976002634, "verification_time": 0, "benchmark_time": 605.5945567786694, "TFLOPS": 6.3833628618817695, "N_PER_WARP": 128, "M_PER_WARP": 128, "Watt": 65.49938824987866, "TFLOPS/J": 0.09781349935189515, "strategy_time": 0, "framework_time": 2.869012765586376, "timestamp": "2024-11-19 19:25:42.502220+00:00"},
"1485,32,1,1,128,256,1": {"nvml_gr_clock": 1485, "block_size_x": 32, "block_size_y": 1, "block_size_z": 1, "M_PER_BLOCK": 128, "N_PER_BLOCK": 256, "NBUFFER": 1, "ps_energy": 13.902165158228465, "ps_power": 58.68809275194486, "core_freq": 1478.0561374109761, "temperature": 36.76280610884716, "time": 237.2660675048828, "times": [240.99122619628906, 236.1333770751953, 237.1840057373047, 236.8153533935547, 236.58189392089844, 236.2460174560547, 236.9105987548828], "compile_time": 63995.561639778316, "verification_time": 0, "benchmark_time": 1663.7466317042708, "TFLOPS": 2.3170435607134863, "N_PER_WARP": 256, "M_PER_WARP": 128, "Watt": 58.68809275194486, "TFLOPS/J": 0.03954461823974293, "strategy_time": 0, "framework_time": 2.084912732243538, "timestamp": "2024-11-19 19:26:48.163655+00:00"},
"1485,32,1,1,128,256,2": {"nvml_gr_clock": 1485, "block_size_x": 32, "block_size_y": 1, "block_size_z": 1, "M_PER_BLOCK": 128, "N_PER_BLOCK": 256, "NBUFFER": 2, "ps_energy": 8.925266791172882, "ps_power": 60.88474838194116, "core_freq": 1395.9170305676855, "temperature": 35.494970927326406, "time": 147.0240216936384, "times": [141.82400512695312, 137.77305603027344, 146.7709503173828, 156.32383728027344, 142.62477111816406, 151.1260223388672, 152.7255096435547], "compile_time": 64992.5278602168, "verification_time": 0, "benchmark_time": 1032.172824256122, "TFLOPS": 3.739224431185503, "N_PER_WARP": 256, "M_PER_WARP": 128, "Watt": 60.88474838194116, "TFLOPS/J": 0.061595448825318054, "strategy_time": 0, "framework_time": 2.3757359012961388, "timestamp": "2024-11-19 19:27:54.190759+00:00"},
"1485,32,1,1,256,16,1": {"nvml_gr_clock": 1485, "block_size_x": 32, "block_size_y": 1, "block_size_z": 1, "M_PER_BLOCK": 256, "N_PER_BLOCK": 16, "NBUFFER": 1, "ps_energy": 1.4305049688170715, "ps_power": 54.49642419138661, "core_freq": 1485.0, "temperature": 35.97156771799629, "time": 26.090345110212052, "times": [26.077184677124023, 26.059776306152344, 26.039295196533203, 26.13555145263672, 26.101728439331055, 26.072063446044922, 26.14681625366211], "compile_time": 1344.3584609776735, "verification_time": 0, "benchmark_time": 185.50120294094086, "TFLOPS": 21.071235798748383, "N_PER_WARP": 16, "M_PER_WARP": 256, "Watt": 54.49642419138661, "TFLOPS/J": 0.3843089159925183, "strategy_time": 0, "framework_time": 2.2678542882204056, "timestamp": "2024-11-19 19:27:55.722910+00:00"},
"1485,32,1,1,256,16,2": {"nvml_gr_clock": 1485, "block_size_x": 32, "block_size_y": 1, "block_size_z": 1, "M_PER_BLOCK": 256, "N_PER_BLOCK": 16, "NBUFFER": 2, "ps_energy": 1.5304796566049066, "ps_power": 42.95970704158923, "core_freq": 1485.0, "temperature": 35.81216931216931, "time": 35.383587973458425, "times": [35.40377426147461, 35.38022232055664, 35.378177642822266, 35.38022232055664, 35.37919998168945, 35.383296966552734, 35.38022232055664], "compile_time": 1323.7406937405467, "verification_time": 0, "benchmark_time": 251.2680757790804, "TFLOPS": 15.53702847490699, "N_PER_WARP": 16, "M_PER_WARP": 256, "Watt": 42.95970704158923, "TFLOPS/J": 0.35920491429956947, "strategy_time": 0, "framework_time": 2.072729170322418, "timestamp": "2024-11-19 19:27:57.300010+00:00"},
"1485,32,1,1,256,32,1": {"nvml_gr_clock": 1485, "block_size_x": 32, "block_size_y": 1, "block_size_z": 1, "M_PER_BLOCK": 256, "N_PER_BLOCK": 32, "NBUFFER": 1, "ps_energy": 4.19481114082438, "ps_power": 68.21101872343448, "core_freq": 1485.0, "temperature": 36.860070245485325, "time": 61.344329833984375, "times": [61.57004928588867, 61.35603332519531, 61.290496826171875, 61.21779251098633, 61.464576721191406, 61.25465774536133, 61.2567024230957], "compile_time": 2835.1008845493197, "verification_time": 0, "benchmark_time": 432.13114980608225, "TFLOPS": 8.961803240426612, "N_PER_WARP": 32, "M_PER_WARP": 256, "Watt": 68.21101872343448, "TFLOPS/J": 0.1310561537652348, "strategy_time": 0, "framework_time": 2.0185792818665504, "timestamp": "2024-11-19 19:28:00.569303+00:00"},
"1485,32,1,1,256,32,2": {"nvml_gr_clock": 1485, "block_size_x": 32, "block_size_y": 1, "block_size_z": 1, "M_PER_BLOCK": 256, "N_PER_BLOCK": 32, "NBUFFER": 2, "ps_energy": 3.6071091732606613, "ps_power": 46.974096338894746, "core_freq": 1485.0, "temperature": 36.792297357814604, "time": 76.34680720738002, "times": [76.18457794189453, 76.43033599853516, 76.37709045410156, 76.3842544555664, 76.17842864990234, 76.4590072631836, 76.41395568847656], "compile_time": 1896.1819745600224, "verification_time": 0, "benchmark_time": 539.5659655332565, "TFLOPS": 7.200770195860374, "N_PER_WARP": 32, "M_PER_WARP": 256, "Watt": 46.974096338894746, "TFLOPS/J": 0.15240897557615257, "strategy_time": 0, "framework_time": 2.6326514780521393, "timestamp": "2024-11-19 19:28:03.007710+00:00"},
"1485,32,1,1,256,64,1": {"nvml_gr_clock": 1485, "block_size_x": 32, "block_size_y": 1, "block_size_z": 1, "M_PER_BLOCK": 256, "N_PER_BLOCK": 64, "NBUFFER": 1, "ps_energy": 9.35429577611246, "ps_power": 61.993505483228724, "core_freq": 1403.7362637362637, "temperature": 37.42595499738358, "time": 150.68160138811385, "times": [150.17779541015625, 150.5597381591797, 151.77113342285156, 150.7307586669922, 150.5638427734375, 150.10406494140625, 150.86387634277344], "compile_time": 24146.1578020826, "verification_time": 0, "benchmark_time": 1058.0507451668382, "TFLOPS": 3.6484601226926316, "N_PER_WARP": 64, "M_PER_WARP": 256, "Watt": 61.993505483228724, "TFLOPS/J": 0.058770411695969735, "strategy_time": 0, "framework_time": 3.0479691922664642, "timestamp": "2024-11-19 19:28:28.214995+00:00"},
"1485,32,1,1,256,64,2": {"nvml_gr_clock": 1485, "block_size_x": 32, "block_size_y": 1, "block_size_z": 1, "M_PER_BLOCK": 256, "N_PER_BLOCK": 64, "NBUFFER": 2, "ps_energy": 5.507348495048713, "ps_power": 66.21216246308573, "core_freq": 1483.2897384305834, "temperature": 37.96842130602606, "time": 82.99578530447823, "times": [83.51334381103516, 82.82316589355469, 82.95629119873047, 82.88665771484375, 83.13241577148438, 82.82316589355469, 82.83545684814453], "compile_time": 24095.729424618185, "verification_time": 0, "benchmark_time": 584.1976413503289, "TFLOPS": 6.623900380858697, "N_PER_WARP": 64, "M_PER_WARP": 256, "Watt": 66.21216246308573, "TFLOPS/J": 0.09982223103953718, "strategy_time": 0, "framework_time": 1.9624670967459679, "timestamp": "2024-11-19 19:28:52.896922+00:00"},
"1485,32,1,1,256,128,1": {"nvml_gr_clock": 1485, "block_size_x": 32, "block_size_y": 1, "block_size_z": 1, "M_PER_BLOCK": 256, "N_PER_BLOCK": 128, "NBUFFER": 1, "ps_energy": 21.47508405237204, "ps_power": 57.28312868602039, "core_freq": 1485.0, "temperature": 38.42357359729853, "time": 374.7582571847098, "times": [373.0616455078125, 379.3203125, 372.61004638671875, 377.37677001953125, 371.0044250488281, 376.5821533203125, 373.3524475097656], "compile_time": 9964.803735725582, "verification_time": 0, "benchmark_time": 2626.38951651752, "TFLOPS": 1.4669611765673196, "N_PER_WARP": 128, "M_PER_WARP": 256, "Watt": 57.28312868602039, "TFLOPS/J": 0.02559970487413652, "strategy_time": 0, "framework_time": 2.0809676498174667, "timestamp": "2024-11-19 19:29:05.490224+00:00"},
"1485,32,1,1,256,128,2": {"nvml_gr_clock": 1485, "block_size_x": 32, "block_size_y": 1, "block_size_z": 1, "M_PER_BLOCK": 256, "N_PER_BLOCK": 128, "NBUFFER": 2, "ps_energy": 9.110688222487495, "ps_power": 62.13661906860573, "core_freq": 1485.0, "temperature": 39.56593472403058, "time": 146.50660487583704, "times": [146.12173461914062, 145.9578857421875, 148.64895629882812, 143.214599609375, 145.8483123779297, 146.20364379882812, 149.5511016845703], "compile_time": 9964.491702616215, "verification_time": 0, "benchmark_time": 1028.3046942204237, "TFLOPS": 3.752430235851229, "N_PER_WARP": 128, "M_PER_WARP": 256, "Watt": 62.13661906860573, "TFLOPS/J": 0.060341853487101325, "strategy_time": 0, "framework_time": 2.156146802008152, "timestamp": "2024-11-19 19:29:16.485220+00:00"},
"1485,32,1,1,256,256,1": {"nvml_gr_clock": 1485, "block_size_x": 32, "block_size_y": 1, "block_size_z": 1, "M_PER_BLOCK": 256, "N_PER_BLOCK": 256, "NBUFFER": 1, "ps_energy": 23.82475942151489, "ps_power": 57.015688596539505, "core_freq": 1467.4016563146997, "temperature": 39.66718578191751, "time": 417.76918247767856, "times": [415.2709045410156, 421.4261779785156, 417.6250915527344, 417.0782775878906, 416.1771545410156, 420.0755310058594, 416.73114013671875], "compile_time": 17841.806042939425, "verification_time": 0, "benchmark_time": 2927.3310620337725, "TFLOPS": 1.3159319474632947, "N_PER_WARP": 256, "M_PER_WARP": 256, "Watt": 57.015688596539505, "TFLOPS/J": 0.02307497860362629, "strategy_time": 0, "framework_time": 1.742587424814701, "timestamp": "2024-11-19 19:29:37.256124+00:00"},
"1485,32,1,2,32,16,1": {"nvml_gr_clock": 1485, "block_size_x": 32, "block_size_y": 1, "block_size_z": 2, "M_PER_BLOCK": 32, "N_PER_BLOCK": 16, "NBUFFER": 1, "ps_energy": 1.6020075949626127, "ps_power": 75.59313285863584, "core_freq": 1485.0, "temperature": 41.1984126984127, "time": 20.70732797895159, "times": [20.734975814819336, 20.703231811523438, 20.705280303955078, 20.69913673400879, 20.710399627685547, 20.695039749145508, 20.703231811523438], "compile_time": 1013.6472089216113, "verification_time": 0, "benchmark_time": 150.31376108527184, "TFLOPS": 26.548853355044706, "N_PER_WARP": 16, "M_PER_WARP": 16, "Watt": 75.59313285863584, "TFLOPS/J": 0.3431667962228544, "strategy_time": 0, "framework_time": 2.07735039293766, "timestamp": "2024-11-19 19:29:38.422189+00:00"},
"1485,32,1,2,32,16,2": {"nvml_gr_clock": 1485, "block_size_x": 32, "block_size_y": 1, "block_size_z": 2, "M_PER_BLOCK": 32, "N_PER_BLOCK": 16, "NBUFFER": 2, "ps_energy": 1.6514738556327626, "ps_power": 77.39560132046138, "core_freq": 1485.0, "temperature": 41.308035714285715, "time": 21.015986033848353, "times": [21.04524803161621, 21.015552520751953, 20.979679107666016, 21.03398323059082, 20.975616455078125, 21.04115104675293, 21.020671844482422], "compile_time": 1033.063611947, "verification_time": 0, "benchmark_time": 151.05918981134892, "TFLOPS": 26.15893506031852, "N_PER_WARP": 16, "M_PER_WARP": 16, "Watt": 77.39560132046138, "TFLOPS/J": 0.332887990937865, "strategy_time": 0, "framework_time": 1.9223131239414215, "timestamp": "2024-11-19 19:29:39.608251+00:00"},
"1485,32,1,2,32,16,4": {"nvml_gr_clock": 1485, "block_size_x": 32, "block_size_y": 1, "block_size_z": 2, "M_PER_BLOCK": 32, "N_PER_BLOCK": 16, "NBUFFER": 4, "ps_energy": 1.6839851044447383, "ps_power": 77.83551576315381, "core_freq": 1485.0, "temperature": 41.34523809523809, "time": 21.43027196611677, "times": [21.539840698242188, 21.403648376464844, 21.410816192626953, 21.27462387084961, 21.47327995300293, 21.375999450683594, 21.533695220947266], "compile_time": 1016.2614686414599, "verification_time": 0, "benchmark_time": 153.0729327350855, "TFLOPS": 25.65323551456624, "N_PER_WARP": 16, "M_PER_WARP": 16, "Watt": 77.83551576315381, "TFLOPS/J": 0.3264612094471414, "strategy_time": 0, "framework_time": 1.800907775759697, "timestamp": "2024-11-19 19:29:40.779405+00:00"},
"1485,32,1,2,32,16,8": {"nvml_gr_clock": 1485, "block_size_x": 32, "block_size_y": 1, "block_size_z": 2, "M_PER_BLOCK": 32, "N_PER_BLOCK": 16, "NBUFFER": 8, "ps_energy": 1.8814312730324414, "ps_power": 73.61454447821042, "core_freq": 1485.0, "temperature": 41.300000000000004, "time": 25.473453794206893, "times": [25.474048614501953, 25.475040435791016, 25.4781436920166, 25.467872619628906, 25.47711944580078, 25.469951629638672, 25.472000122070312], "compile_time": 1012.2160408645868, "verification_time": 0, "benchmark_time": 180.60794658958912, "TFLOPS": 21.58151848309726, "N_PER_WARP": 16, "M_PER_WARP": 16, "Watt": 73.61454447821042, "TFLOPS/J": 0.2922008482414125, "strategy_time": 0, "framework_time": 1.7939135432243347, "timestamp": "2024-11-19 19:29:41.974047+00:00"},
"1485,32,1,2,32,32,1": {"nvml_gr_clock": 1485, "block_size_x": 32, "block_size_y": 1, "block_size_z": 2, "M_PER_BLOCK": 32, "N_PER_BLOCK": 32, "NBUFFER": 1, "ps_energy": 1.0685857568506825, "ps_power": 74.94728609859112, "core_freq": 1485.0, "temperature": 41.04571428571428, "time": 13.866715431213379, "times": [13.87929630279541, 13.859840393066406, 13.856767654418945, 13.900799751281738, 13.864959716796875, 13.851648330688477, 13.8536958694458], "compile_time": 1063.9552306383848, "verification_time": 0, "benchmark_time": 101.31378564983606, "TFLOPS": 39.64571254202876, "N_PER_WARP": 32, "M_PER_WARP": 16, "Watt": 74.94728609859112, "TFLOPS/J": 0.5144704674973686, "strategy_time": 0, "framework_time": 1.8671602010726929, "timestamp": "2024-11-19 19:29:43.141201+00:00"},
"1485,32,1,2,32,32,2": {"nvml_gr_clock": 1485, "block_size_x": 32, "block_size_y": 1, "block_size_z": 2, "M_PER_BLOCK": 32, "N_PER_BLOCK": 32, "NBUFFER": 2, "ps_energy": 1.089198452189651, "ps_power": 76.80195655980592, "core_freq": 1485.0, "temperature": 41.06122448979592, "time": 14.063615935189384, "times": [14.078975677490234, 14.064640045166016, 14.052351951599121, 14.06873607635498, 14.065664291381836, 14.0513277053833, 14.063615798950195], "compile_time": 1074.4746252894402, "verification_time": 0, "benchmark_time": 100.8446617051959, "TFLOPS": 39.09064471196375, "N_PER_WARP": 32, "M_PER_WARP": 16, "Watt": 76.80195655980592, "TFLOPS/J": 0.5047342959245013, "strategy_time": 0, "framework_time": 2.0190421491861343, "timestamp": "2024-11-19 19:29:44.318557+00:00"},
"1485,32,1,2,32,32,4": {"nvml_gr_clock": 1485, "block_size_x": 32, "block_size_y": 1, "block_size_z": 2, "M_PER_BLOCK": 32, "N_PER_BLOCK": 32, "NBUFFER": 4, "ps_energy": 1.1747808527562873, "ps_power": 74.36596906464696, "core_freq": 1485.0, "temperature": 41.05291602807131, "time": 15.53656700679234, "times": [15.551487922668457, 15.541248321533203, 15.529984474182129, 15.533056259155273, 15.533056259155273, 15.531007766723633, 15.536128044128418], "compile_time": 1079.3253239244223, "verification_time": 0, "benchmark_time": 112.29403875768185, "TFLOPS": 35.38463893906907, "N_PER_WARP": 32, "M_PER_WARP": 16, "Watt": 74.36596906464696, "TFLOPS/J": 0.46796456768779915, "strategy_time": 0, "framework_time": 1.8651960417628288, "timestamp": "2024-11-19 19:29:45.512060+00:00"},
"1485,32,1,2,32,32,8": {"nvml_gr_clock": 1485, "block_size_x": 32, "block_size_y": 1, "block_size_z": 2, "M_PER_BLOCK": 32, "N_PER_BLOCK": 32, "NBUFFER": 8, "ps_energy": 1.72966709607655, "ps_power": 65.68140026934124, "core_freq": 1485.0, "temperature": 40.66627304147465, "time": 25.454299926757812, "times": [25.481216430664062, 25.458688735961914, 25.441280364990234, 25.448448181152344, 25.451520919799805, 25.442304611206055, 25.456640243530273], "compile_time": 1072.4302344024181, "verification_time": 0, "benchmark_time": 186.44826021045446, "TFLOPS": 21.59775815755558, "N_PER_WARP": 32, "M_PER_WARP": 16, "Watt": 65.68140026934124, "TFLOPS/J": 0.3178390888830722, "strategy_time": 0, "framework_time": 1.7870217561721802, "timestamp": "2024-11-19 19:29:46.772744+00:00"},
